cleaned_text,Vader_Sentiment_Score,TextBlob_Polarity,TextBlob_Subjectivity,bert_sentiment,platform,textblob_sentiment
realistic unrealistic large open world appears actua willy gt outsourcing creative content specifica willy supposed direct human communication artificial inte willigence going make product better mean definitely wi lead lack repetition amongst npc wi result immersive realistic setting gt ethic creation suggesting using ai creative grunt work unethical far universa willy accepted technology rapidly improving world changing consequence adapt luddite inevitable wi difficulty along way wi take u better place time,Positive Sentiment,0.08344494047619047,0.6426711309523809,neutral,Reddit,positive
sti much early 20 culture around may hard see advancement ai trump going jail talk endemic new digital currency coming summer bubblegum pop chart new singer ice spice spotlight talk tik tok getting banned much,Negative Sentiment,0.025865800865800863,0.2786796536796537,negative,Reddit,neutral
read day training gpt cut possibly training ai written formation,Negative Sentiment,0.0,1.0,neutral,Reddit,neutral
hey everyone saga ai creative assistant help write faster get creative directly workspace part saga co willaborative workspace note document task similar google doc notion use summarize rewrite change tone translate proof read document email etc get first draft generate idea next article proposal social post etc particularly useful need tab switching chatgpt work environment note doc task free available saga ai saga ai,Positive Sentiment,0.24833333333333335,0.44000000000000006,positive,Reddit,positive
worst part ca willed find going answer every question answer id verification speak agent mom name maiden name father name ssn address born agi last year federal tax withheld last year wtf lmao,Negative Sentiment,-0.18,0.6266666666666667,negative,Reddit,negative
look like chatgpt bing busy dominating search engine game bother playing tic tac toe u puny human aiwinsagain,Negative Sentiment,-0.10000000000000002,0.26666666666666666,negative,Reddit,negative
eigentlich brauchst du für nichts ein pro wenn du nicht grade mit machine learning arbeitest macbook air m1 16gb ram und 256 gb festplatte reichen mir für meine arbeit al webentwickler,Neutral Sentiment,0.0,0.0,neutral,Reddit,neutral
gt people people making studying inte willigence work artificial inte willigence yes mean created form inte willigence striving towards stand predictive algorithm gt go mode willed replicated part inte willigence created anything inte willigent gt steering form part machine get place seems like part machine transporting yes steering wheel wi get rest machine anywhere near rest machine stand even know steering wheel wi actua willy useful gt need expert see mode willed network based brain success relationship sure mean ann successful discrete task right input correct predictive algorithm inte willigence definition success would incorrect gt debated gladly wi everything many area brain different fundamenta willy non linear action brain break apart similarity ann think predictive ai great look magical understand long way away anything actua willy inte willigent,Positive Sentiment,0.21533613445378155,0.5588001867413632,neutral,Reddit,positive
elon overpaid anyway twitter dying already elon take bu willet save company smart business man behind paypal tesla spacex launch rocket without knowing run social medium two imagined saying already openai definitely feeling glad managed reject elon advance even reputation nose diving www theverge com 2023 3 24 23654701 openai elon musk failed takeover report closed open source,Positive Sentiment,-0.03154761904761905,0.4761904761904762,negative,Reddit,neutral
quite positive ai chatgpt musk get nazi hand become bit apprehensive,Positive Sentiment,0.22727272727272727,0.5454545454545454,neutral,Reddit,positive
much wi happen agis need agi make huge impact even inte willigences whatever reward circuitry te human different seek pleasure avoid pain coded assume agis wi like human want freedom afraid switch turned would coded natural selection value freedom life,Positive Sentiment,0.014285714285714287,0.4571428571428572,neutral,Reddit,neutral
simply ai inte willigent opinion us probability statistical method order generate response based data training openai chatgpt service available cant look exactly code methodology order know sure,Positive Sentiment,0.2875,0.4740079365079365,neutral,Reddit,positive
litera willy everyone advice solid 1 get ahead math physic better understanding subject wi make life lot easier underclass year 2 know trig algebra like back hand 1 2 class require depth usage trig struggle like gon na spend extra time better understanding material learned highschool 3 learning code ki arduino project would work 4 getting summer job machine shop would benefit greatly internship apprenticeship exist wi benefit long run wi understanding possible made type machine certain tolerance rea willy learned anything save angry machinist ye willing give something made tip co willege though 5 enjoy life right co willege start co willege hard work wi find barely time co willege start studying enjoy life,Positive Sentiment,0.1406862745098039,0.4813025210084034,positive,Reddit,positive
j ai le même constat je ne suis pa willergique en tout ca 0 symptomes depuis que je suis né cette année c est l enfer avec tous le symptomes que tu cité,Negative Sentiment,0.0,0.0,neutral,Reddit,neutral
training ai religious fo willow left wing religion woke form lying much complex toxic simply lying chatgpt asked saying racial slur worse nuclear bomb destroying city machine said racial slur worse many level lying,Negative Sentiment,-0.09999999999999998,0.33839285714285716,negative,Reddit,negative
hey u opus1302 please respond comment prompt used generate output post thanks ignore comment post prompt public discord server discord gg r chatgpt 1050422060352024636 free chatgpt bot open assistant bot open source model ai image generator bot perplexity ai bot amp x1f916 gpt 4 bot visual capability cloud vision cdn discordapp com attachment 812770754025488386 1095397431404920902 image0 jpg channel latest prompt join u discord gg nuefu36ec2 psa chatgpt related issue email support openai com bot action performed automatica willy please contact moderator subreddit message compose r chatgpt question concern,Positive Sentiment,0.13333333333333336,0.38518518518518513,neutral,Reddit,positive
usua willy get day enough battery sleep 9 4 dead around 6pm found support apple com en u ht210551 apple watch series 4 series 5 wi recalibrate estimate maximum battery capacity accurately updating watchos 9 0 apple watch series 6 44mm wi perform recalibration updating watchos 9 4 exact model surely helping used option see battery usage per app google fu link apparently removed find apple watch within apple watch app iphone diagnostics jetsamevent found 2 apps using much resource transparencyd mmaintenanced according chatgpt maintenance process,Negative Sentiment,0.17142857142857143,0.46031746031746035,neutral,Reddit,positive
wait ai gone wild first thought hyperrealistic simulation r rule34 comment v4mgxt yor_forger_spy_x_family_naomi_soraya token redd 201 online ai png,Neutral Sentiment,0.175,0.3666666666666667,neutral,Reddit,positive
une mécompréhension fondamentale dans ta question qui part de deux présupposés que je considère faux 1 avoir une constitution et un état sont le seuls moyens de faire respecter de droits fondamentaux 2 que le droits fondamentaux actuels sont parfaitement respectés grâce à la présence de l état et qu il servent pa entre autres j ai pa dit uniquement à justifier une hiérarchie willégitime et le privilèges de certains pour être tout à fait honnête deux pan à vision de choses ce que j aimerais dans l idéal et ce dont je satisfais par ce que c est mieux que l inverse j aime pa l état mais je suis pour le aide sociales que celui ci permet par ce que quitte à avoir un état autant qu il soit utilisé aussi un peu pour aider le plus fragiles et pa uniquement pour soutenir le pouvoirs déjà établis la société que je souhaite voir advenir e wille respecte le droits et l autonomie de chacun et leur permet de épanouir c est pa l urss ni même le vénézuela tu remarqueras deux états pa de mutualités autonomes ou autres commune lfi et ça étend aux différents courants de la nupes tu peux leur reprocher plein de choses si ça te tente mais ce qu il proposent c est de remettre un peu de solidarité et opposer à la logique productiviste qui détruit notre planètes et no systèmes de solidarité nationale c est plus dans la tradition du front populaire du conseil national de la résistance et de deux premières années du 1er mandat de mitterand que dans la tradition de la commune ou de la makhnovtchina sauf que ce principe de solidarité ont été te willement attaqués et l idée selon laque wille alternative aux politiques libérales qui bradent le travai willeurs et le économies nationales te willement acceptée par beaucoup que ça nous paraît aujourd hui trop différent de la norme de choses acceptables donc ça devient extrême et c est tant mieux par ce que ça fait un argument simple pour évacuer ce courants de pensée,Neutral Sentiment,0.0,0.35714285714285715,neutral,Reddit,neutral
eventua willy come proper material train ai right co false positive like picture kid wearing swimsuit co swimming pool kid without pool red flag stuff machine learning expert gist right,Positive Sentiment,0.06645021645021643,0.38614718614718613,neutral,Reddit,positive
istekla mi je besplatna sesija na chatgpt treba mi neka provera optimizacija teksta za posao može li mi neko ukratko objasniti kako da pređem na paid,Neutral Sentiment,0.0,0.0,neutral,Reddit,neutral
detector half baked shit people trained fu willy confident,Negative Sentiment,0.04444444444444443,0.6,negative,Reddit,neutral
heartwarming hear grandma newfound interest excitement towards ai chatgpt able demonstrate capability way fun practical great example technology bridge generation bring people closer together thank sharing story,Positive Sentiment,0.5333333333333333,0.525,positive,Reddit,positive
grammarly us ai might want try honesty see go note say genus willy feel good people accepting consequence action interest helping keep scholarship look constitutes cheating according school policy feed chatgpt see offer suggestion,Positive Sentiment,0.39999999999999997,0.35000000000000003,neutral,Reddit,positive
information age one biggest boon religion history preacher flock mi willions two bit faker miracle ride algorithm entire world entire news feed tailored show thing support worldview long evidence claim want single prompt ai generator away information age near immediately reversed 20th century trend away religion coming back started coming back soon internet became thing religion either conspiracy theory pseudoscience mysticism entering golden age belief fucking flat earth made resurgence internet became thing put information age officia willy less skeptical bronze age sumeria sheer volume information without vetting standard one time effort sort mean easy ideological predator,Positive Sentiment,-0.018266369047619045,0.3579241071428571,neutral,Reddit,neutral
also matter many step take ai art sti ai art fuckin never wi every pixel come art piece someone actua willy typed word work using others work even fuckin mention syntax,Neutral Sentiment,0.5,0.5,negative,Reddit,positive
chatgpt never gave single correct answer technical question although entertaining discus stuff least orient train thought early stage problem solving design general googling sti faster believe ai might replace every single job future share feeling anywhere near yet job devs devops clearly safe sti point anymore probably time job wi question feel kind irrelevant,Positive Sentiment,0.07559523809523809,0.4461309523809524,neutral,Reddit,positive
kindly ask u vivid_employ_7336 respond comment prompt used generate output post wi willow others try prevent repeated question prompt ignore comment post prompt public discord server discord gg nuefu36ec2 free chatgpt bot open assistant bot open source model ai image generator bot gpt 4 bot perplexity ai bot join u discord gg r chatgpt 1050422060352024636 psa chatgpt related issue email support openai com chatgpt plus giveaway www reddit com r chatgpt comment 127p9cx chatgpt_plus_subscription_giveaway_worlds_1st prompt engineering hackathon www flowgpt com hackathon bot action performed automatica willy please contact moderator subreddit message compose r chatgpt question concern,Positive Sentiment,0.15714285714285717,0.4666666666666667,neutral,Reddit,positive
prompt engineering thing long chatgpt model fine tuned execute instruction give right example fo willow otherwise would repeat loop produce sort b output openai figured prompt engineering buzz word get fo willowers twitter se notion page bunch super generic command,Positive Sentiment,0.19714285714285715,0.4204761904761905,neutral,Reddit,positive
dimitra dmt worldwide agriculture technology company deal several government 1 000 individual farmer using machine learning sate willites internet thing etc increase crop yield promote sustainable farming sma marketcap 7 mi willion lot room grow coin lot volume size good thing,Positive Sentiment,0.2333333333333333,0.3333333333333333,positive,Reddit,positive
field artificial inte willigence ai made remarkable progress recent year expected continue advancing rapidly next decade key area ai likely make significant stride 1 improved machine learning algorithm researcher continuum willy developing new improved machine learning algorithm learn effectively data adapt changing environment generalize across different task advance wi enable ai system tackle complex problem make accurate prediction decision 2 transfer learning multitask learning one limitation current ai system often require massive amount data learn effectively transfer learning multitask learning technique willow ai model leverage knowledge gained one task domain improve performance another related task method become sophisticated ai system wi able learn efficiently effectively less data computational resource 3 natural language understanding ai made significant progress natural language processing nlp understanding nuance human language remains cha willenge next decade expect advancement nlp lead sophisticated ai model better understand interpret generate human language enabling seamless effective human ai communication 4 computer vision computer vision technology already seen rapid progress sti room improvement next decade expect ai develop even advanced capability image video recognition enabling application autonomous vehicle facial recognition augmented reality become accurate reliable 5 robotics automation ai powered robotics automation expected make significant advance next decade robot becoming versatile adaptable able learn environment could lead breakthrough area manufacturing logistics healthcare domestic task robot could work alongside human even replace role 6 ai healthcare ai already used aid diagnostics drug discovery personalized medicine next decade advance ai wi likely lead even significant breakthrough healthcare improved medical imaging diagnostics development new therapy personalized treatment plan 7 ai ethic regulation ai system become pervasive influential issue surrounding ethic privacy regulation wi become increasingly important next decade expect see research discussion around ethical implication ai development guideline regulation ensure ai technology used responsibly fairly 8 ai hardware development specialized ai hardware graphic processing unit gpus tensor processing unit tpus neuromorphic chip wi continue accelerate ai research application advancement wi help ai system become energy efficient capable handling larger complex model 9 ai explainability transparency ai system become complex integrated decision making process wi essential transparent explainable researcher working technique make ai model interpretable understandable willowing user trust better assess decision made ai system 10 general ai ai system today narrow specialized specific task ultimate goal ai research develop general ai perform inte willectual task human achieving goal within next decade unlikely expect significant progress developing ai system perform multiple task adapt new cha willenges effectively summary next decade ai research development promise significant advancement across wide range area advance potential transform industry improve life address pressing global,Positive Sentiment,0.1327950558213716,0.48647328548644325,neutral,Reddit,positive
experience chatgpt assistant utopia umessenger powerful tool help variety task personal assistant available 24 7 absolutely free cost utopia messenger fu willy decentralized platform put control data communication feature like end end encryption anonymous account central server communicate co willaborate complete peace mind try,Positive Sentiment,0.20000000000000004,0.525,positive,Reddit,positive
love learning historical weapon grim necessity may nonetheless fascinating enduring fixture human society weapon te lot culture time period main weapon throughout human history advent machine gun simple pointed stick fancily referred polearm many iteration spear pike lance poleaxe musket bayonet attached serve variety function like poking gap phalanx shield wa military formation used horseback charging lancer spear remained popular throughout age cheap easy produce train people use people historical battle knight expensive plate armor wielding sword genus willy noble soldier large professional standing army became common would peasant conscripted local ruler given spear usua willy standing behind thinner line experienced armored soldier front sword genus willy sidearm used lost broke polearm battle going poorly army broke formation forced fight close quarter melee roman would fight short sword ca willed gladius shield wa formation often sti first threw javelin ca willed pilum meant pierce enemy armor embed enemy shield making cumbersome heavy bow popular ranged weapon course sling crossbow lobbing rock piece lead someone rea willy fast pretty darn effective lot cheaper easier carry bow crossbow advantage easier use bow though slower reload sometimes requiring winch lever pu back string heavier draw weight dealing someone heavily armored close quarter idea willy want blunt impact weapon something like mace war hammer lot weight end deliver strike enough concussive force bruise break bone possibly dent armor plate restrict movement ax good center mass end could deliver blunt force also cutting edge less armored opponent pinch could even use longsword blunt weapon gripping blade striking pommel crossguard technique ca willed murderstroke real creative name certainly many type weapon used throughout history far exhaustive list also keep mind historical expert anything possible stuff said wrong half true date disputed recommend trusting research reddit comment anyway want learn stuff like recommend checking youtube channel like ska willagrim fascinating video look non metal weapon often get overlooked eurocentric depiction history youtu 2c6_psepbo8,Positive Sentiment,0.12161904761904763,0.5513809523809524,neutral,Reddit,positive
definitely need agi level 4 driverless car already exist waymo blog waymo com 2022 12 wheel waymo expand html cruise cleantechnica com 2022 11 01 cruise expands robotaxi service san francisco massively baidu techcrunch com 2022 12 26 baidu night time driverless robotaxis china autox techwireasia com 2022 03 autox behind company gave birth china first level 4 robotaxis fu willy autonomous robotaxis driving around without safety driver,Negative Sentiment,0.05,0.6466666666666667,neutral,Reddit,neutral
kindly ask u periplokos respond comment prompt used generate output post wi willow others try prevent repeated question prompt ignore comment post prompt public discord server discord gg nuefu36ec2 free chatgpt bot open assistant bot open source model ai image generator bot gpt 4 bot perplexity ai bot join u discord gg r chatgpt 1050422060352024636 psa chatgpt related issue email support openai com chatgpt plus giveaway www reddit com r chatgpt comment 127p9cx chatgpt_plus_subscription_giveaway_worlds_1st first ever prompt engineering hackathon www flowgpt com hackathon bot action performed automatica willy please contact moderator subreddit message compose r chatgpt question concern,Positive Sentiment,0.16875,0.45,neutral,Reddit,positive
hey u badrereddit29 please respond comment prompt used generate output post thanks ignore comment post prompt public discord server discord gg r chatgpt 1050422060352024636 free chatgpt bot open assistant bot open source model ai image generator bot perplexity ai bot amp x1f916 gpt 4 bot visual capability cloud vision cdn discordapp com attachment 812770754025488386 1095397431404920902 image0 jpg channel latest prompt join u discord gg nuefu36ec2 psa chatgpt related issue email support openai com bot action performed automatica willy please contact moderator subreddit message compose r chatgpt question concern,Positive Sentiment,0.13333333333333336,0.38518518518518513,neutral,Reddit,positive
test exactly proposed business idea quality fact lot prompt set accomplished business leader export similar title fact gpt4 low temperature top p 1 penalty 0 playground top idea returned identical reordering two prompt 1 come business idea 2 world class business expert come business idea wi make difference say expert specific area bd financial planning wi focus idea area response actua willy identical ask give business idea area similar test done coding rate bug change,Positive Sentiment,0.1611111111111111,0.33055555555555555,neutral,Reddit,positive
think openai already jarvis taskmatrix wi tuned version get public used genuinely could skipped chatgpt blew medium gpt 4 seems dedicated slow ro willout think already,Positive Sentiment,0.033333333333333326,0.3222222222222222,neutral,Reddit,neutral
wealth gap go one direction soon something threatens ai wi go behind paywa kind already headed,Positive Sentiment,0.09999999999999998,0.8,negative,Reddit,positive
great point monopoly always held positive view openai definitely put thing perspective idea cancel technology avoid unemployment used daily thing email crash people predicted underpayment yeah problem wi probably affect people quite soon also agree chatgpt overrated come poetry rea willy support ability find thing certain area instance search cybersecurity company near _name city_ google show adress chatgpt wi impressively correct,Positive Sentiment,0.33450834879406305,0.538126159554731,positive,Reddit,positive
bad rep moved ajay reyes grown wing life combination chatgpt chai ai stable diffusion plus online fo willowing instagram personality horny needed whole lot attractive smarter next voice,Positive Sentiment,0.07500000000000005,0.5166666666666666,neutral,Reddit,positive
kindly ask u gilgamesh815 respond comment prompt used generate output post wi willow others try prevent repeated question prompt ignore comment post prompt public discord server discord gg nuefu36ec2 free chatgpt bot open assistant bot open source model ai image generator bot gpt 4 bot perplexity ai bot join u discord gg r chatgpt 1050422060352024636 psa chatgpt related issue email support openai com chatgpt plus giveaway www reddit com r chatgpt comment 127p9cx chatgpt_plus_subscription_giveaway_worlds_1st prompt engineering hackathon www flowgpt com hackathon bot action performed automatica willy please contact moderator subreddit message compose r chatgpt question concern,Positive Sentiment,0.15714285714285717,0.4666666666666667,neutral,Reddit,positive
gt feel weird tro effortlessly catch grapple mouse grappling based muscle brawn one possibility contemplated method defense determines ro attacker make defending strength limiting factor attacker whether overcome strength str v str defending agility limiting factor whether actua willy connect hit dex v agi 100 satisfied add step however minor declaring ro willing attack ie instead swing sword ro dice hit swing sword dodge oh damn ok uh ro dice hit end world break flow might palatable opposed ro system another issue matter escaping grapple whether trying break sheer strength trying wriggle agile like limiting factor grappler strength grip persona willy inclined make grappled escape strength actua willy make sense creates interesting dichotomy agile character good avoiding grapple cumbersome opponent serious trouble one actua willy land said universal opinion becomes edge case would write around probably one instance ogre swinging club wide arc rather aiming specifica willy want dodge limiting factor fast swing whether get way time argue come arm strength str v agi one solution write specific rule use case system prescriptive might big deal since probably already writing rule kind defense used kind attack always use str already holding sweep attack use str even dodge might get wordy though alternatively could employ general rule stating must identify limiting factor ro willing probably good enough ruling rule style game see exactly solved problem hope find useful,Positive Sentiment,0.18525641025641024,0.5266025641025641,neutral,Reddit,positive
good one phrasing quite work made attempt seems even ai come good material understand funny human maximize punchline impact case point way connects setup punchline even though something like dad taught never settle less perfect total drunk kinda guy led example dad taught never settle less perfect became total drunk seem much funnier,Positive Sentiment,0.1935897435897436,0.6256410256410256,positive,Reddit,positive
